,word
835,incurable romantic lotte finds life upended plans picture-perfect wedding unravel -- self-absorbed sister gets engaged.. 
836,"secrets truths unfold lives female friends one suburban neighborhood , mysterious suicide neighbor . "
837,"presidencies kennedy johnson , vietnam war , watergate scandal historical events unfold perspective alabama man iq 75 , whose desire reunited childhood sweetheart . "
838,"young man woman decide take friendship next level without becoming couple , soon discover adding sex leads complications . "
839,"murphy american living paris enters highly sexually emotionally charged relationship electra . unaware effect relationship , invite pretty neighbor bed . "
840,"mistaken younger really , single mother decides take chance reboot career love life 26-year old . "
841,"telepathic waitress sookie stackhouse encounters strange new supernatural world meets mysterious bill compton , southern louisiana gentleman vampire . "
842,tully kate support good times bad unbreakable bond carries teens forties . 
843,newly sober single mom tries pull life together napa valley dealing wayward mother . 
844,"life spartacus , gladiator lead rebellion romans . time ally romans , betrayal becoming gladiator , rebellion leads ultimate outcome . "
845,"los angeles beach , team lifeguards led lieutenant mitch buchannon save lives , deal personal dramas , fight crime participate top adventures daily basis . "
846,four people otherworldly frienemy struggle afterlife define means good . 
847,"young clark kent struggles find place world learns harness alien powers good deals typical troubles teenage life smallville , kansas . "
848,fedex executive undergoes physical emotional transformation crash landing deserted island . 
849,four friends small coastal town help cope adolescence . 
850,epic next chapter cinematic monsterverse pits two greatest icons motion picture history one another - fearsome godzilla mighty kong - humanity caught balance . 
851,"following events 'avengers : endgame , ' sam wilson/falcon bucky barnes/winter soldier team global adventure tests abilities -- patience . "
852,film natasha romanoff quests films civil war infinity war . 
853,"first generation superheroes kept world safe nearly century . children must live legacy epic drama spans decades navigates dynamics family , power loyalty . "
854,"determined ensure superman 's ultimate sacrifice vain , bruce wayne aligns forces diana prince plans recruit team metahumans protect world approaching threat catastrophic proportions . "
855,mma fighter cole young seeks earth 's greatest champions order stand enemies outworld high stakes battle universe . 
856,adult animated series based skybound/image comic teenager whose father powerful superhero planet . 
857,"supervillains harley quinn , bloodsport , peacemaker collection nutty cons belle reve prison join super-secret , super-shady task force x dropped remote , enemy-infused island corto maltese . "
858,"world supervillains commonplace , two estranged childhood best friends reunite one devises treatment gives powers protect city . "
859,add plot 
860,"young woman , run 10 years suffocating marriage tech billionaire , suddenly realizes husband implanted revolutionary monitoring device brain allows track every move . "
861,"16 year-old girl returns home camp learns mother new boyfriend , one intends marry ; man whose charm , intelligence beauty make look like 's human . "
862,"two unlikely companions embark perilous adventure badlands unexplored planet try escape dangerous disorienting reality , inner thoughts seen heard everyone . "
863,"blends style classic sitcoms mcu , wanda maximoff vision - two super-powered beings living ideal suburban lives - begin suspect everything seems . "
864,"crypto-zoological agency monarch faces battery god-sized monsters , including mighty godzilla , collides mothra , rodan , ultimate nemesis , three-headed king ghidorah . "
865,"set dystopian future , woman forced live concubine fundamentalist theocratic dictatorship . "
866,"struck lightning , barry allen wakes coma discover 's given power super speed , becoming next flash , fighting crime central city . "
867,"young boy disappears , mother , police chief friends must confront terrifying supernatural forces order get back . "
868,"crew astronauts multi-generational mission descend paranoia madness , knowing real . "
869,"seven years world become frozen wasteland , remnants humanity inhabit perpetually-moving train circles globe , class warfare , social injustice politics survival play . "
870,crash-landed alien named harry takes identity small-town colorado doctor slowly begins wrestle moral dilemma secret mission earth . 
871,group vigilantes set take corrupt superheroes abuse superpowers . 
872,"travels lone bounty hunter outer reaches galaxy , far authority new republic . "
873,"vietnam war , team scientists explores uncharted island pacific , venturing domain mighty kong , must fight escape primal eden . "
874,"world beset appearance monstrous creatures , one may one save humanity . "
875,"fueled restored faith humanity inspired superman 's selfless act , bruce wayne enlists help new-found ally , diana prince , face even greater enemy . "
876,"armed one word , tenet , fighting survival entire world , protagonist journeys twilight world international espionage mission unfold something beyond real time . "
877,"epic tale following gang victorian women find unusual abilities , relentless enemies , mission might change world . "
878,"devastating events avengers : infinity war ( 2018 ) , universe ruins . help remaining allies , avengers assemble order reverse thanos ' actions restore balance universe . "
879,survivors plane crash forced work together order survive seemingly deserted tropical island . 
880,"alternative version 1969 , soviet union beats united states moon , space race continues decades still grander challenges goals . "
881,"anthology series exploring twisted , high-tech multiverse humanity 's greatest innovations darkest instincts collide . "
882,"walking dead spin-off , set los angeles , following two families must band together survive undead apocalypse . "
883,adventures superman 's cousin superhero career . 
884,"presumed dead , passengers onboard flight 828 return discover world aged five years . reintegrate society , begin experience guiding voices visions , soon deeper mystery unfolds . "
885,"set intersection near future reimagined past , explore world every human appetite indulged without consequence . "
886,"world ruins , due man-made plague , battle biblical proportions ensues survivors . "
887,"follow world 's famous super hero comic books ' famous journalist deal stress , pressures , complexities come working parents today 's society . "
888,adventures time space alien adventurer known doctor companions planet earth . 
889,"missions strategic homeland intervention , enforcement logistics division . "
890,"24th century , disparate band antiheroes unravel vast conspiracy threatens solar system 's fragile state cold war . "
891,"two f.b.i . agents , fox mulder believer dana scully skeptic , investigate strange unexplained , hidden forces work impede efforts . "
892,"set ninety-seven years nuclear war destroyed civilization , spaceship housing humanity 's lone survivors sends one hundred juvenile delinquents back earth , hopes possibly re-populating planet . "
893,"love -- lies -- spiral dna researcher helps discover way find perfect partner , creates bold new matchmaking service . "
894,"desperate attempt win basketball match earn freedom , looney tunes seek aid retired basketball champion , michael jordan . "
895,animated series follows exploits super scientist not-so-bright grandson . 
896,"t'challa , heir hidden advanced kingdom wakanda , must step forward lead people new future must confront challenger country 's past . "
897,"ten years kirk , spock , enterprise , uss discovery discovers new worlds lifeforms one starfleet officer learns understand things alien . "
898,continuation spider-man far home 
899,"set almost 100 years captain kirk 's five-year mission , new generation starfleet officers set u.s.s . enterprise-d mission go one gone . "
900,serialized remake 'the princess bride ' told short chapters featuring celebrities home quarantine . 
901,"home bored pandemic lockdown , zoë bell picks fight boss bitch friends . glorious mayhem ensues . "
902,"`` two distant strangers '' , cartoonist carter james ' repeated attempts get home dog thwarted recurring deadly encounter forces re-live awful day ... see full summary » "
903,"12-year-old boy best friend , wise 28-year-old dog magical powers , go series surreal adventures remote future . "
904,"collection animated short stories span various genres including science fiction , fantasy , horror comedy . "
905,slice-of-life adventures australian blue heeler cattle dog puppy fun family friends everyday situations . 
906,"years hiding , obi-wan kenobi struggles reconnect force order protect luke skywalker imperial forces . "
907,"phineas ferb invent , scheme , stay one step ahead bratty sister . meanwhile , pet platypus plots evil dr. doofenshmirtz . "
908,daily surreal adventures blue jay raccoon duo attempt deal mundane jobs groundskeepers local park . 
909,"twenty-five years second movie 's release , banks family gathered together zoom call special wedding-related announcement . "
910,add plot 
911,"terrifying origin story pandemic , diamond princess chronicles first largest outbreak novel coronavirus outside china : diamond princess cruise liner . ... see full summary » "
912,"venice : city full beauty , love , music , brutal trash talk . join pom 's team saying `` au revoir , chris hemsworth '' . "
913,"young single mother drops son bus stop visit dad paris . late work , almost gets fired . end duties gets tricky situation handles , advice colleague gave . "
914,"ralph , bunny interviewed documentary , goes daily routine `` tester '' lab . "
915,"superhero roommates robin , cyborg , starfire , raven beast boy love saving day , happens 're done fighting crime ? "
916,"guardians galaxy video , guardians inferno , featuring 80s pop star zardu hasselfrau . "
917,humorous piece looks waititi 's work director digital-physical-voice actor film . 
918,"ordinary anne boonchuy , 13 , finds treasure chest sends amphibia , world full frogs , toads , giant insects . help sprig , must adjust life amphibia discover first true friendship life . "
919,add plot 
920,"takes place 1869 , events original movie . finally reveal cursed game came adventures first people played jumanji . "
921,"follow blitz , classic demon imp sets run small assassin business weapons specialist moxxie , bruiser millie , receptionist hellhound loona . together ... see full summary » "
922,inside series name . 
923,detective jackson briggs recruits assassin hanzo hasachi undercover mission - enter illegal tournament eliminate criminal participants . 
924,"adventurous life cricket green , country boy moves family rural farm modern metropolis . "
925,"2019 hong kong rocked largest protests since britain handed back area china 1997. story protests , told series demonstrations local ... see full summary » "
926,"quibi series explores stories based urban legends different places united states , taking viewers deeper horrors lurk beneath surface . "
927,"jewish funeral service parents , college student runs sugar daddy . "
928,"wedding anniversary , yusef young daughter set west bank buy wife gift . soldiers , segregated roads checkpoints , easy would go shopping ? "
929,"gcpd looking missing police officers , batman gets invitation old foe arkham asylum . "
930,"tom holland , zendaya jacob batalon `` accidentally '' reveal title marvel 's spider-man 3 , directed jon watts . movie 's title spider-man : way home , released theaters christmas 2021 . "
931,"aftermath tragedy , two grieving parents journey emotional void mourn loss child . "
932,"corrections officer transferred letter room , soon finds enmeshed prisoner 's deeply private life . "
933,updated iteration classic looney tunes characters focusing satirical misadventures living suburbia . 
934,ben 10 fifth iteration ben 10 franchise . serves reboot television series loosely based upon original series . 
935,"twenty-five years events four weddings funeral ( 1994 ) , charles , carrie , fiona , tom , david , matthew , bernard , lydia father gerald back church . whose wedding - familiar faces ? "
936,"series features comic fights iconic pair adversaries , house cat ( tom ) mouse ( jerry ) . plots short usually center tom jerry 's numerous attempts ... see full summary » "
937,people love everything porn ... except sex . 
938,"desperate take care pregnant wife terminal illness take life , dodge maynard accepts offer participate deadly game soon discovers 's hunter - prey . "
939,elderly couple regain youth rain . 
940,"secret agent michael scarn ( played steve carell ) forced retirement due death wife catherine zeta-scarn , president united states america ( played ... see full summary » "
941,"woman watches time passing next suitcases ex-lover ( supposed come pick , never arrives ) restless dog n't understand master abandoned . two living beings facing abandonment . "
942,"léo dragged nudist camping resort mother . like boys age 12 13 , nude public holds little appeal léo , protests wearing extra layers . ... see full summary » "
943,"short prequel first pirates caribbean movie , two feisty brides-to-be discover something common - absent groom . still , plenty pirates 'd love trade goats 'em . "
944,unassuming young rideshare driver thrown worst nightmare mysterious hollywood hills passenger enters car . 
945,"1985 , kung fury , toughest martial artist cop miami , goes back time kill worst criminal time - kung führer , a.k.a . adolf hitler . "
946,"catastrophe betrayed , teams female crime-fighters take back get revenge arsyn . "
947,"state union follows louise tom meet pub immediately weekly marital therapy session . episode pieces together lives , drew together , started pull apart . "
948,"brian dundee tries locate father , crocodile dundee , australian outback . "
949,inside look making american crime story : assassination gianni versace . 
950,"failing make cut join powerhouse mighty ducks junior hockey team , 12-year-old evan 's mother encourages form new team underdogs help gordon bombay , ducks ' original coach . "
951,follows us american football coach ted lasso heading uk manage struggling london football team top flight english football . 
952,"decades 1984 valley karate tournament bout , middle-aged daniel larusso johnny lawrence find martial-arts rivals . "
953,"desperate attempt win basketball match earn freedom , looney tunes seek aid retired basketball champion , michael jordan . "
954,self-centered minnesota lawyer sentenced community service coaching rag tag youth hockey team . 
955,"half-brothers lucas nathan scott trade kinship rivalry basketball court hearts friends small , quiet town tree hill , north carolina . "
956,american car designer carroll shelby driver ken miles battle corporate interference laws physics build revolutionary race car ford order defeat ferrari 24 hours le mans 1966 . 
957,gordon 's team win junior goodwill games california spite set-backs ? 
958,"jeff `` dude '' lebowski , mistaken millionaire name , seeks restitution ruined rug enlists bowling buddies help get . "
959,"summer 1962 , new kid town taken wing young baseball prodigy rowdy team , resulting many adventures . "
960,"drama follows lives dillon panthers , one nation 's best high school football teams , head coach eric taylor . "
961,rejected hockey player puts skills golf course save grandmother 's house . 
962,martial arts master agrees teach karate bullied teenager . 
963,"high school wrestler spokane , washington trouble focusing training regimen beautiful young drifter takes temporary residence home . "
964,merciless 1970s rivalry formula one rivals james hunt niki lauda . 
965,oakland 's general manager billy beane 's successful attempt assemble baseball team lean budget employing computer-generated analysis acquire new players . 
966,"unruly team hockey misfits grows bit receives scholarships prestigious prep school , take snotty varsity team . "
967,champion high school cheerleading squad discovers previous captain stole best routines inner-city school must scramble compete year 's championships . 
968,"hot-shot race-car named lightning mcqueen gets waylaid radiator springs , finds true meaning friendship family . "
969,"star high school football player south central recruited play beverly hills high school , two separate worlds collide . "
970,"competitive ice skater tonya harding rises amongst ranks u.s. figure skating championships , future activity thrown doubt ex-husband intervenes . "
971,docuseries following fia formula one world championship across multiple seasons . 
972,"talented teen figure skater kayla forced leave everything behind family follows twin brother , mac , prestigious hockey academy . "
973,small-time boxer gets supremely rare chance fight heavyweight champion bout strives go distance self-respect . 
974,group misfits enter las vegas dodgeball tournament order save cherished local gym onslaught corporate health fitness chain . 
975,"pro football strike , owners hire substitute players . "
976,former wrestler family make living performing small venues around country kids dream joining world wrestling entertainment . 
977,"jack cunningham high school basketball phenom walked away game , forfeiting future . years later , reluctantly accepts coaching job alma mater , may get one last shot redemption . "
978,"determined like volleyball championship 's star player shouyou , short boy nicknamed `` small giant , '' joins school 's volleyball club . "
979,"youngest son alcoholic former boxer returns home , 's trained father competition mixed martial arts tournament - path puts fighter collision course estranged , older brother . "
980,two sisters join first female professional baseball league struggle help succeed amidst growing rivalry . 
981,"near-fatal plane crash wwii , olympian louis zamperini spends harrowing 47 days raft two fellow crewmen 's caught japanese navy sent prisoner-of-war camp . "
982,look personal professional lives group women perform wrestling organization los angeles 1980s . 
983,exclusive golf course deal brash new member destructive dancing gopher . 
984,"story michael oher , homeless traumatized boy became all-american football player first-round nfl draft pick help caring woman family . "
985,determined woman works hardened boxing trainer become professional . 
986,ensemble comedy follows group old friends fantasy football league care deeply one another -- deeply use every opportunity make 's lives miserable . 
987,"former world heavyweight champion rocky balboa serves trainer mentor adonis johnson , son late friend former rival apollo creed . "
988,"aimless young man scalping tickets , gambling , drinking , agrees coach little league team cabrini green housing project chicago condition getting loan friend . "
989,"tutelage rocky balboa , newly crowned heavyweight champion adonis creed faces viktor drago , son ivan drago . "
990,"brother decides ditch couple weeks , viola heads elite boarding school , disguised , proceeds fall school 's star soccer player , soon learns 's one romantic troubles . "
991,true story newly appointed african-american coach high school team first season racially integrated unit . 
992,"sports agent moral epiphany fired expressing , decides put new philosophy test independent agent athlete stays former colleague . "
993,mike o'donnell ungrateful life turned . gets chance rewrite life tried save janitor near bridge jumped time vortex . 
994,"series centered around group football players families , friends handlers . "
995,"number one nascar driver ricky bobby stays atop heap thanks pact best friend teammate , cal naughton , jr. french formula one driver , makes way ladder , ricky bobby 's talent devotion put test . "
996,"charting rise 1990 's chicago bulls , led michael jordan , one notable dynasties sports history . "
997,prison inmates form football team challenge prison guards . 
998,"figure skating olympic hopeful 's struggle balance love , family fragile mental health dream winning takes dizzying hold . "
999,"american grand prix driver pete aron fired jordan-brm racing team crash monaco injures british teammate , scott stoddard . "
1000,epic next chapter cinematic monsterverse pits two greatest icons motion picture history one another - fearsome godzilla mighty kong - humanity caught balance . 
1001,sheriff deputy rick grimes wakes coma learn world ruins must lead group survivors stay alive . 
1002,"twisting , real-life story charles sobhraj , murderer , thief seductive master disguise , hidden darkness mid-70 's asia 's hippie trail . "
1003,mma fighter cole young seeks earth 's greatest champions order stand enemies outworld high stakes battle universe . 
1004,adult animated series based skybound/image comic teenager whose father powerful superhero planet . 
1005,"black family moves all-white los angeles neighborhood malevolent forces , next door otherworldly , threaten taunt , ravage destroy . "
1006,"drama series following investigations ac-12 , controversial police anti-corruption unit . "
1007,"hell-bent exacting revenge proving framed sister 's murder , álex sets unearth much crime 's real culprit . "
1008,"16 year-old girl returns home camp learns mother new boyfriend , one intends marry ; man whose charm , intelligence beauty make look like 's human . "
1009,bystander intervenes help woman harassed group men becomes target vengeful drug lord . 
1010,"new fbi profiler , elizabeth keen , entire life uprooted mysterious criminal , raymond reddington , eluded capture decades , turns insists speaking . "
1011,homeschooled teenager begins suspect mother keeping dark secret . 
1012,teenage murder witness finds pursued twin assassins montana wilderness survival expert tasked protecting -- forest fire threatening consume . 
1013,"young woman , traumatized tragic event past , seeks vengeance crossed path . "
1014,"prank goes disastrously wrong , group boys sent detention center brutalized . thirteen years later , unexpected random encounter former guard gives chance revenge . "
1015,"series follows special victims unit , specially trained squad detectives n.y.p.d. , investigate sexually related crimes . "
1016,high school chemistry teacher diagnosed inoperable lung cancer turns manufacturing selling methamphetamine order secure family 's future . 
1017,"cases f.b.i . behavioral analysis unit ( b.a.u . ) , elite group profilers analyze nation 's dangerous serial killers individual heinous crimes effort anticipate next moves strike . "
1018,unusual group robbers attempt carry perfect robbery spanish history - stealing 2.4 billion euros royal mint spain . 
1019,"set dystopian future , woman forced live concubine fundamentalist theocratic dictatorship . "
1020,mohamedou ould slahi fights freedom detained imprisoned without charge u.s. government years . 
1021,"young boy disappears , mother , police chief friends must confront terrifying supernatural forces order get back . "
1022,"crew astronauts multi-generational mission descend paranoia madness , knowing real . "
1023,"seven years world become frozen wasteland , remnants humanity inhabit perpetually-moving train circles globe , class warfare , social injustice politics survival play . "
1024,elliot stabler returns nypd battle organized crime devastating personal loss . 
1025,"two brothers follow father 's footsteps hunters , fighting evil supernatural beings many kinds , including monsters , demons gods roam earth . "
1026,"cases naval criminal investigative service 's washington , d.c. major case response team , led special agent leroy jethro gibbs . "
1027,"reckless flight attendant alcoholism problem wakes wrong hotel , wrong bed , dead man - idea happened . unable piece night together , begins wonder could killer . "
1028,"world beset appearance monstrous creatures , one may one save humanity . "
1029,"armed one word , tenet , fighting survival entire world , protagonist journeys twilight world international espionage mission unfold something beyond real time . "
1030,"epic tale following gang victorian women find unusual abilities , relentless enemies , mission might change world . "
1031,"story 7 people trial stemming various charges surrounding uprising 1968 democratic national convention chicago , illinois . "
1032,"john clark , navy seal , goes path avenge wife 's murder find inside larger conspiracy . "
1033,"follows louise , single mom son part-time job psychiatrist 's office . begins affair boss strikes unlikely friendship wife . "
1034,survivors plane crash forced work together order survive seemingly deserted tropical island . 
1035,"financial advisor drags family chicago missouri ozarks , must launder money appease drug boss . "
1036,"april 1986 , explosion chernobyl nuclear power plant union soviet socialist republics becomes one world 's worst man-made catastrophes . "
1037,"anthology series exploring twisted , high-tech multiverse humanity 's greatest innovations darkest instincts collide . "
1038,"walking dead spin-off , set los angeles , following two families must band together survive undead apocalypse . "
1039,"anthology series centering different characters locations , including house murderous past , insane asylum , witch coven , freak show circus , haunted hotel , possessed farmhouse , cult , apocalypse , slasher summer camp . "
1040,"various chronicles deception , intrigue murder around frozen minnesota . yet tales mysteriously lead back one way another fargo , north dakota . "
