,word
202,"world supervillains commonplace , two estranged childhood best friends reunite one devises treatment gives powers protect city . "
203,"young woman , run 10 years suffocating marriage tech billionaire , suddenly realizes husband implanted revolutionary monitoring device brain allows track every move . "
204,"scrappy , feisty , fiercely loyal chicago family makes apologies . "
205,"blends style classic sitcoms mcu , wanda maximoff vision - two super-powered beings living ideal suburban lives - begin suspect everything seems . "
206,"mockumentary group typical office workers , workday consists ego clashes , inappropriate behavior , tedium . "
207,"heartwarming emotional story unique set triplets , struggles wonderful parents . "
208,"rich video-store magnate johnny rose family suddenly find broke , forced leave pampered lives regroup schitt 's creek . "
209,"realm known kumandra , re-imagined earth inhabited ancient civilization , warrior named raya determined find last dragon . "
210,three different related families face trials tribulations uniquely comedic ways . 
211,crash-landed alien named harry takes identity small-town colorado doctor slowly begins wrestle moral dilemma secret mission earth . 
212,"ginny miller , angsty fifteen-year-old , often feels mature thirty-year-old mother , irresistible dynamic georgia miller . "
213,"comedy series following exploits det . jake peralta diverse , lovable colleagues police nypd 's 99th precinct . "
214,"14-year-old persian boy desperately tries fit , cope mother 's dating life , figure cultural identity . "
215,follows personal professional lives six twenty thirty-something-year-old friends living manhattan . 
216,look lives employees big box store . 
217,group vigilantes set take corrupt superheroes abuse superpowers . 
218,"reckless flight attendant alcoholism problem wakes wrong hotel , wrong bed , dead man - idea happened . unable piece night together , begins wonder could killer . "
219,three grown-up siblings find living vastly different levels financial security one another . 
220,mix scripted buddy comedy road movie real hidden camera prank show follows outrageous misadventures two buds stuck rut embark cross-country road trip nyc . storyline sets shocking real pranks . 
221,woman moves apartment across hall two brilliant socially awkward physicists shows little know life outside laboratory . 
222,"failing make cut join powerhouse mighty ducks junior hockey team , 12-year-old evan 's mother encourages form new team underdogs help gordon bombay , ducks ' original coach . "
223,african monarch akeem learns long-lost son united states must return america meet unexpected heir build relationship son . 
224,crooked legal guardian drains savings elderly wards meets match woman tries swindle turns first appears . 
225,follows us american football coach ted lasso heading uk manage struggling london football team top flight english football . 
226,"starting n't easy , especially john nolan , life-altering incident , pursuing dream joining lapd . oldest rookie , 's met skepticism see walking midlife crisis . "
227,"forensic anthropologist dr. temperance `` bones '' brennan cocky f.b.i . special agent seeley booth build team investigate murders . quite often , n't examine rotten flesh mere bones . "
228,father recounts children - series flashbacks - journey four best friends took leading meeting mother . 
229,three suburban mothers suddenly find desperate circumstances decide stop playing safe risk everything take power back . 
230,meet child genius named sheldon cooper ; ( already seen adult big bang theory ( 2007 ) ) family . unique challenges face sheldon seems socially impaired . 
231,absurd antics indiana town 's public officials pursue sundry projects make city better place . 
232,"landing gig lifetime , new york jazz pianist suddenly finds trapped strange land earth afterlife . "
233,"run drug deal gone bad , brilliant college dropout mike ross , finds working harvey specter , one new york city 's best lawyers . "
234,"decades 1984 valley karate tournament bout , middle-aged daniel larusso johnny lawrence find martial-arts rivals . "
235,suspended lawyer forced enroll community college eccentric staff student body . 
236,five friends big egos small brains proprietors irish pub philadelphia . 
237,glimpse outrageous lives loves responsible global women 's magazine . 
238,"four friends , high school teachers , test theory improve lives maintaining constant level alcohol blood . "
239,"desperate attempt win basketball match earn freedom , looney tunes seek aid retired basketball champion , michael jordan . "
240,"bad break-up , jess , offbeat young woman , moves apartment loft three single men . although find behavior unusual , men support - time . "
241,animated series follows exploits super scientist not-so-bright grandson . 
242,"detective investigates death patriarch eccentric , combative family . "
243,live-action prequel feature film following young cruella de vil . 
244,"dramedy centering around relationship thirtysomething single mother teen daughter living stars hollow , connecticut . "
245,"stuck time loop , two wedding guests develop budding romance living day . "
246,"fired job dumped boyfriend , cosmetics saleswoman becomes nanny three children rich english widower . time passes , two fall . "
247,"wacky rhode island town , dysfunctional family strive cope everyday life thrown one crazy scenario another . "
248,1930 's hollywood reevaluated eyes scathing social critic alcoholic screenwriter herman j. mankiewicz races finish screenplay citizen kane ( 1941 ) . 
249,satiric adventures working-class family misfit city springfield . 
250,"twisting , real-life story charles sobhraj , murderer , thief seductive master disguise , hidden darkness mid-70 's asia 's hippie trail . "
251,"drama series following investigations ac-12 , controversial police anti-corruption unit . "
252,"set victorian london , series follows gang troubled street teens manipulated solving crimes sinister doctor watson mysterious business partner , elusive sherlock holmes . "
253,"hell-bent exacting revenge proving framed sister 's murder , álex sets unearth much crime 's real culprit . "
254,bystander intervenes help woman harassed group men becomes target vengeful drug lord . 
255,"new fbi profiler , elizabeth keen , entire life uprooted mysterious criminal , raymond reddington , eluded capture decades , turns insists speaking . "
256,"young woman , traumatized tragic event past , seeks vengeance crossed path . "
257,"prank goes disastrously wrong , group boys sent detention center brutalized . thirteen years later , unexpected random encounter former guard gives chance revenge . "
258,"series follows special victims unit , specially trained squad detectives n.y.p.d. , investigate sexually related crimes . "
259,high school chemistry teacher diagnosed inoperable lung cancer turns manufacturing selling methamphetamine order secure family 's future . 
260,"cases f.b.i . behavioral analysis unit ( b.a.u . ) , elite group profilers analyze nation 's dangerous serial killers individual heinous crimes effort anticipate next moves strike . "
261,"gangster family epic set 1900s england , centering gang sew razor blades peaks caps , fierce boss tommy shelby . "
262,unusual group robbers attempt carry perfect robbery spanish history - stealing 2.4 billion euros royal mint spain . 
263,elliot stabler returns nypd battle organized crime devastating personal loss . 
264,"potential series pilot follows legal advocate blue collar background , helps need without law degree . "
265,"comedy series following exploits det . jake peralta diverse , lovable colleagues police nypd 's 99th precinct . "
266,"cases naval criminal investigative service 's washington , d.c. major case response team , led special agent leroy jethro gibbs . "
267,group vigilantes set take corrupt superheroes abuse superpowers . 
268,"london detectives investigate crimes past , unravelling secrets left buried years . "
269,"new jersey mob boss tony soprano deals personal professional issues home business life affect mental state , leading seek professional psychiatric counseling . "
270,"trials tribulations criminal lawyer jimmy mcgill time established strip-mall law office albuquerque , new mexico . "
271,lucifer morningstar decided 's enough dutiful servant hell decides spend time earth better understand humanity . settles los angeles - city angels . 
272,veteran detective chief inspector young sergeant investigate murders around regional community midsomer county . 
273,"navigating troubled waters romance , school family , archie gang become entangled dark riverdale mysteries . "
274,organized crime dynasty 's aging patriarch transfers control clandestine empire reluctant son . 
275,"financial advisor drags family chicago missouri ozarks , must launder money appease drug boss . "
276,"various chronicles deception , intrigue murder around frozen minnesota . yet tales mysteriously lead back one way another fargo , north dakota . "
277,crooked legal guardian drains savings elderly wards meets match woman tries swindle turns first appears . 
278,anthology series examines ordinary people commit brutal crimes . 
279,"starting n't easy , especially john nolan , life-altering incident , pursuing dream joining lapd . oldest rookie , 's met skepticism see walking midlife crisis . "
280,"forensic anthropologist dr. temperance `` bones '' brennan cocky f.b.i . special agent seeley booth build team investigate murders . quite often , n't examine rotten flesh mere bones . "
281,biker struggles balance father involved outlaw motorcycle club . 
282,"paris , late 1960s . madame claude head flourishing business dedicated prostitution gives power french political criminal worlds . end empire closer thinks . "
283,"judge confronts convictions son involved hit run embroils organized crime family . facing impossible choices , discovers far father go save son 's life . "
284,three suburban mothers suddenly find desperate circumstances decide stop playing safe risk everything take power back . 
285,"baltimore drug scene , seen eyes drug dealers law enforcement . "
286,bipolar cia operative becomes convinced prisoner war turned al-qaeda planning carry terrorist attack american soil . 
287,"set post-jax teller world , `` mayans mc '' sees ez reyes , former golden boy fresh prison , prospect mayan mc charter california-mexico border must carve new outlaw identity . "
288,plot unknown . 
289,"two f.b.i . agents , fox mulder believer dana scully skeptic , investigate strange unexplained , hidden forces work impede efforts . "
290,commentary spanish society dressed thriller misadventures gang young petty criminals real estate crash . 
291,"day , mild-mannered dexter blood-spatter analyst miami police . night , serial killer targets murderers . "
292,"sara teen girl looking forward 18th birthday move away controlling father . could even blow candles , imprisons basement home . "
293,"early 1990s boston , ada decourcy ward forms unlikely alliance corrupt venerated fbi veteran , jackie rohr . together , take case changes city 's entire criminal justice system . "
294,aaron falk returns drought-stricken hometown attend tragic funeral . return opens decades-old wound - unsolved death teenage girl . 
295,"love -- lies -- spiral dna researcher helps discover way find perfect partner , creates bold new matchmaking service . "
296,"criminal mastermind unleashes twisted form justice spiral , terrifying new chapter book saw . "
297,"cherry drifts college dropout army medic iraq - anchored true love , emily . returning war ptsd , life spirals drugs crime struggles find place world . "
298,"menace known joker wreaks havoc chaos people gotham , batman must accept one greatest psychological physical tests ability fight injustice . "
299,"detective investigates death patriarch eccentric , combative family . "
300,"passionate ocean life , filmmaker sets document harm humans marine species - uncovers alarming global corruption . "
301,explore painstaking process hemingway created important works fiction american letters . 
302,"documentary filmmaker cullen hoback sets uncover forces behind qanon , attention turns 8chan , site `` q '' posts . "
303,"march 18 , 1990 , 13 works art stolen isabella stewart gardner museum boston . guards admitted two men posing police officers responding disturbance call , thieves tied guards looted museum . "
304,"path new world , unsettling intricate story genocides . conquest , slavery fabrication `` whiteness '' . "
305,"filmmaker forges unusual friendship octopus living south african kelp forest , learning animal shares mysteries world . "
306,"real-life pirates caribbean violently plunder , stealing form surprisingly egalitarian republic documentary series . "
307,docuseries following fia formula one world championship across multiple seasons . 
308,"account six-week death spiral brought company 's ipo , behind-the-scenes look wework 's frat-boy culture . "
309,director alexander nanau follows crack team investigators romanian newspaper gazeta sporturilor try uncover vast health-care fraud enriched moguls politicians led deaths innocent citizens . 
310,"never-before-seen story behind murder michael jordan 's father , james jordan "
311,reenactments drive documentary investigating mastermind behind scam sneak kids rich famous families top us universities . 
312,"2004 , world 's attention turned quiet swedish village knutby young woman murdered . "
313,"washington post journalist jamal khashoggi disappears istanbul , fiancée dissidents around world piece together clues murder expose global cover . "
314,"mit media lab researcher joy buolamwini discovers facial recognition see dark-skinned faces accurately , embarks journey push first-ever u.s. legislation bias algorithms impact us . "
315,stanley tucci travels across italy discover secrets delights country 's regional cuisines . 
316,"rick marty lagina , two brothers michigan life-long interest mystery oak island , renew efforts discover legendary treasure sophisticated machinery . "
317,"funny , heartfelt moving docuseries , real people unpack fascinating quirky stories around meaningful pieces clothing . "
318,"british engineer dick strawbridge wife angel buy rundown french chateau . series shows course year , restore building stood empty 40 years . "
319,exclusive access grammy award-winning artist celebrate career . 
320,three men kilts review popular culture humorous send-up internet review shows . 
321,"charting rise 1990 's chicago bulls , led michael jordan , one notable dynasties sports history . "
322,"intimate look young hollywood starlets growing 1990s , using hundreds hours footage captured soleil moon frye . "
323,"follow shocking , yet humorous , journey aspiring environmentalist , daringly seeks find real solution pressing environmental issues true path sustainability . "
324,"documentary series , explores aspects led demi lovato 's nearly fatal overdose 2018 , awakenings aftermath . "
325,"wildlife documentary series david attenborough , beginning look remote islands offer sanctuary planet 's rarest creatures , beauty cities , home humans , animals.. "
326,"documentary last remaining blockbuster video , located bend , oregon . "
327,"fight everest ? seemed incredible . 2013 news channels around world reported ugly brawl 6400 ( 21,000 ft ) european climbers fled mob angry sherpas . 1953 , ... see full summary » "
328,"1980 's detroit , 17 year-old richard wershe , jr. allegedly ran sophisticated inner-city drug dealing operation . , journalists , police , federal agents hit men speaking first time legend `` white boy rick . '' "
329,"explores dangerous human impact social networking , tech experts sounding alarm creations . "
330,"zak bagans , aaron goodwin , billy tolley , jay wasley investigate scariest , notorious , haunted places world . "
331,private investigator chile hires someone work mole retirement home client suspects caretakers elder abuse . 
332,limited docu-series tells true story one notorious serial killers american history hunted brought justice . 
333,science mythology - thing . 
334,"road woodstock , revolution blossomed ramshackle summer camp teenagers disabilities , transforming lives igniting landmark movement . "
335,"series filmed two years unprecedented access greater manchester police , offering front-line insight one police force 's battle organized crime . "
336,documentary looks daily life pig farm animal companions : two cows one-legged chicken . 
337,"terrifying origin story pandemic , diamond princess chronicles first largest outbreak novel coronavirus outside china : diamond princess cruise liner . ... see full summary » "
338,"chilling story one world 's notorious serial killers told words gacy , forever changed unspeakable deeds believe full truth remains concealed day . "
339,chronicles famous leaders roman civilization . 
340,"hysterical honest hilarious backstage pass lives stand-up comedy 's boundary-breaking women , exploring hard-fought journey become voices generation gender . "
341,"nathan fielder uses business degree life experiences help real small businesses turn profit . unorthodox approach , nathan 's genuine efforts good often draw real people experience far beyond signed . "
342,high-stakes exploits turn deadly - shake global church core - extraordinary true crime story . 
343,pornstar veteran rocco siffredi shares experience porn industry porn academy budapest . 
344,"fox rich fights release husband , rob , serving 60-year sentence prison . "
345,exploration discovery laws nature coordinates space time . 
346,"college student tourist elisa lam vanishes , leaving behind possessions hotel room . cecil hotel grows infamy . "
347,documentary young women drawn sex trade - easy web-savvy generation end making porn . 
348,ottoman sultan mehmed ii wages epic campaign take byzantine capital constantinople shapes course history centuries . 
349,exploration warring kingdoms feudal japan several powerful warlords fought become absolute ruler . 
350,"following events 'avengers : endgame , ' sam wilson/falcon bucky barnes/winter soldier team global adventure tests abilities -- patience . "
351,sheriff deputy rick grimes wakes coma learn world ruins must lead group survivors stay alive . 
352,"twisting , real-life story charles sobhraj , murderer , thief seductive master disguise , hidden darkness mid-70 's asia 's hippie trail . "
353,"first generation superheroes kept world safe nearly century . children must live legacy epic drama spans decades navigates dynamics family , power loyalty . "
354,adult animated series based skybound/image comic teenager whose father powerful superhero planet . 
355,drama centered personal professional lives five surgical interns supervisors . 
356,"black family moves all-white los angeles neighborhood malevolent forces , next door otherworldly , threaten taunt , ravage destroy . "
357,"nine noble families fight control lands westeros , ancient enemy returns dormant millennia . "
358,"drama series following investigations ac-12 , controversial police anti-corruption unit . "
359,"set victorian london , series follows gang troubled street teens manipulated solving crimes sinister doctor watson mysterious business partner , elusive sherlock holmes . "
360,"hell-bent exacting revenge proving framed sister 's murder , álex sets unearth much crime 's real culprit . "
361,"young woman , run 10 years suffocating marriage tech billionaire , suddenly realizes husband implanted revolutionary monitoring device brain allows track every move . "
362,"hometown destroyed mother killed , young eren jaeger vows cleanse earth giant humanoid titans brought humanity brink extinction . "
363,"scrappy , feisty , fiercely loyal chicago family makes apologies . "
364,"moses , egyptian prince , learns true heritage hebrew divine mission deliverer people . "
365,"man refuses assistance daughter ages . tries make sense changing circumstances , begins doubt loved ones , mind even fabric reality . "
366,"new fbi profiler , elizabeth keen , entire life uprooted mysterious criminal , raymond reddington , eluded capture decades , turns insists speaking . "
367,"sent live estranged father summer , rebellious teen finds kinship tight-knit philadelphia community black cowboys . "
368,"blends style classic sitcoms mcu , wanda maximoff vision - two super-powered beings living ideal suburban lives - begin suspect everything seems . "
369,teenage murder witness finds pursued twin assassins montana wilderness survival expert tasked protecting -- forest fire threatening consume . 
370,follows political rivalries romance queen elizabeth ii 's reign events shaped second half twentieth century . 
371,"young woman , traumatized tragic event past , seeks vengeance crossed path . "
372,"prank goes disastrously wrong , group boys sent detention center brutalized . thirteen years later , unexpected random encounter former guard gives chance revenge . "
373,"series follows special victims unit , specially trained squad detectives n.y.p.d. , investigate sexually related crimes . "
374,high school chemistry teacher diagnosed inoperable lung cancer turns manufacturing selling methamphetamine order secure family 's future . 
375,"vikings transports us brutal mysterious world ragnar lothbrok , viking warrior farmer yearns explore - raid - distant shores across ocean . "
376,"cases f.b.i . behavioral analysis unit ( b.a.u . ) , elite group profilers analyze nation 's dangerous serial killers individual heinous crimes effort anticipate next moves strike . "
377,"gangster family epic set 1900s england , centering gang sew razor blades peaks caps , fierce boss tommy shelby . "
378,"set dystopian future , woman forced live concubine fundamentalist theocratic dictatorship . "
379,"heartwarming emotional story unique set triplets , struggles wonderful parents . "
380,mohamedou ould slahi fights freedom detained imprisoned without charge u.s. government years . 
381,"struck lightning , barry allen wakes coma discover 's given power super speed , becoming next flash , fighting crime central city . "
382,"young boy disappears , mother , police chief friends must confront terrifying supernatural forces order get back . "
383,english combat nurse 1945 mysteriously swept back time 1743 . 
384,"seven years world become frozen wasteland , remnants humanity inhabit perpetually-moving train circles globe , class warfare , social injustice politics survival play . "
385,three different related families face trials tribulations uniquely comedic ways . 
386,elliot stabler returns nypd battle organized crime devastating personal loss . 
387,new medical director breaks rules heal system america 's oldest public hospital . 
388,crash-landed alien named harry takes identity small-town colorado doctor slowly begins wrestle moral dilemma secret mission earth . 
389,"ginny miller , angsty fifteen-year-old , often feels mature thirty-year-old mother , irresistible dynamic georgia miller . "
390,"wealth , lust , betrayal set backdrop regency-era england , seen eyes powerful bridgerton family . "
391,"potential series pilot follows legal advocate blue collar background , helps need without law degree . "
392,"two brothers follow father 's footsteps hunters , fighting evil supernatural beings many kinds , including monsters , demons gods roam earth . "
393,"cases naval criminal investigative service 's washington , d.c. major case response team , led special agent leroy jethro gibbs . "
394,"quarter-life crisis causes young chinese-american woman , nicky chen , drop college go life-changing journey isolated monastery china . returns find hometown overrun crime corruption , nicky uses martial arts skills shaolin values protect community bring criminals justice -- searching assassin ... see full summary » "
395,"reckless flight attendant alcoholism problem wakes wrong hotel , wrong bed , dead man - idea happened . unable piece night together , begins wonder could killer . "
396,"london detectives investigate crimes past , unravelling secrets left buried years . "
397,"new jersey mob boss tony soprano deals personal professional issues home business life affect mental state , leading seek professional psychiatric counseling . "
398,"losing everything great recession , woman embarks journey american west , living van-dwelling modern-day nomad . "
399,heavy-metal drummer 's life thrown freefall begins lose hearing . 
400,nba superstar lebron james teams bugs bunny rest looney tunes long-awaited sequel . 
401,"realm known kumandra , re-imagined earth inhabited ancient civilization , warrior named raya determined find last dragon . "
402,"harry potter begins sixth year hogwarts , discovers old book marked `` property half-blood prince '' begins learn lord voldemort 's dark past . "
403,adventures time space alien adventurer known doctor companions planet earth . 
404,"landing gig lifetime , new york jazz pianist suddenly finds trapped strange land earth afterlife . "
405,"orphaned boy enrolls school wizardry , learns truth , family terrible evil haunts magical world . "
406,"desperate attempt win basketball match earn freedom , looney tunes seek aid retired basketball champion , michael jordan . "
407,"fired job dumped boyfriend , cosmetics saleswoman becomes nanny three children rich english widower . time passes , two fall . "
408,"multi-generational saga set alberta , canada centered family getting life together happy trying times . "
409,"chaotic battle ensues jerry mouse , taken refuge royal gate hotel , tom cat , hired drive away day big wedding arrives . "
410,"marinette adrien , two normal teens , transform superheroes ladybug cat noir evil threatens city . "
