,word
411,mom dad usually say decide say yes kids ' wildest requests ground rules whirlwind day fun adventure . 
412,self-centered minnesota lawyer sentenced community service coaching rag tag youth hockey team . 
413,"nowhere left go , hawkins finds camp first time . instinct run , finds friend , father figure even girl awakens heart . , finally finds home . "
414,"harry potter finds competing hazardous tournament rival schools magic , distracted recurring nightmares . "
415,"e.b. , easter bunny 's teenage son , heads hollywood , determined become drummer rock ' n ' roll band . la , 's taken fred out-of-work slacker hits e.b . car . "
416,aspiring young country singer ( katharine mcphee ) finds band 's missing takes job nanny musically talented family : rugged cowboy ( eddie cibrian ) five children . 
417,young girl destined liberate world grip magisterium represses people 's ties magic animal spirits known daemons . 
418,"countryside town bordering magical land , young man makes promise beloved 'll retrieve fallen star venturing magical realm . "
419,young apprentice hunter father journey ireland help wipe last wolf pack . everything changes befriends free-spirited girl mysterious tribe rumored transform wolves night . 
420,snobbish phonetics professor henry higgins agrees wager make flower girl eliza doolittle presentable high society . 
421,feature adaptation beatrix potter 's classic tale rebellious rabbit trying sneak farmer 's vegetable garden . 
422,young chinese maiden disguises male warrior order save father . 
423,"war-torn world elemental magic , young boy reawakens undertake dangerous mystic quest fulfill destiny avatar , bring peace world . "
424,"teen miles morales becomes spider-man universe , must join five spider-powered individuals dimensions stop threat realities . "
425,gordon 's team win junior goodwill games california spite set-backs ? 
426,"gifted young teen tries survive life dimwitted , dysfunctional family . "
427,"harry potter , ron hermione return hogwarts school witchcraft wizardry third year study , delve mystery surrounding escaped prisoner poses dangerous threat young wizard . "
428,life adventures ingalls family nineteenth century american midwest . 
429,newly recruited night security guard museum natural history discovers ancient curse causes animals exhibits display come life wreak havoc . 
430,"young boy wins tour magnificent chocolate factory world , led world 's unusual candy maker . "
431,"scooby gang face challenging mystery ever : plot unleash ghost dog cerberus upon world . race stop dogpocalypse , gang discovers scooby epic destiny greater anyone imagined . "
432,"warning lord voldemort 's return scoffed , harry dumbledore targeted wizard authorities authoritarian bureaucrat slowly seizes power hogwarts . "
433,"home sick bed , young boy 's grandfather reads story farmboy-turned-pirate encounters numerous obstacles , enemies allies quest reunited true love . "
434,"prehistoric family croods challenged rival family bettermans , claim better evolved . "
435,adolescent two siblings tests various theories life endures trials growing alongside good friend . 
436,"four hockey players minnesota aspire become boyband . kendall , logan , carlos , james embark life-changing journey face challenges along way . "
437,group young misfits called goonies discover ancient map set adventure find legendary pirate 's long-lost treasure . 
438,"city humanoid animals , hustling theater impresario 's attempt save theater singing competition becomes grander anticipates even finalists find lives never . "
439,alfalfa wooing darla `` he-man-woman-hating '' friends attempt sabotage relationship . 
440,young boy grandmother run-in coven witches leader . 
441,ancient prophecy seems coming true mysterious presence begins stalking corridors school magic leaving victims paralyzed . 
442,"ancient polynesia , terrible curse incurred demigod maui reaches moana 's island , answers ocean 's call seek demigod set things right . "
443,second installment `` fantastic beasts '' series featuring adventures magizoologist newt scamander . 
444,"selfish prince cursed become monster rest life , unless learns fall love beautiful young woman keeps prisoner . "
445,"summer 1962 , new kid town taken wing young baseball prodigy rowdy team , resulting many adventures . "
446,dorothy gale swept away farm kansas magical land oz tornado embarks quest new friends see wizard help return home kansas help friends well . 
447,"mean lord exiles fairytale creatures swamp grumpy ogre , must go quest rescue princess lord order get land back . "
448,"shrek fiona travel kingdom far far away , fiona 's parents king queen , celebrate marriage . arrive , find welcome thought would . "
449,"city anthropomorphic animals , rookie bunny cop cynical con artist fox must work together uncover conspiracy . "
450,"first generation superheroes kept world safe nearly century . children must live legacy epic drama spans decades navigates dynamics family , power loyalty . "
451,"determined ensure superman 's ultimate sacrifice vain , bruce wayne aligns forces diana prince plans recruit team metahumans protect world approaching threat catastrophic proportions . "
452,mma fighter cole young seeks earth 's greatest champions order stand enemies outworld high stakes battle universe . 
453,adult animated series based skybound/image comic teenager whose father powerful superhero planet . 
454,"nine noble families fight control lands westeros , ancient enemy returns dormant millennia . "
455,"world supervillains commonplace , two estranged childhood best friends reunite one devises treatment gives powers protect city . "
456,"set victorian london , series follows gang troubled street teens manipulated solving crimes sinister doctor watson mysterious business partner , elusive sherlock holmes . "
457,add plot 
458,"hometown destroyed mother killed , young eren jaeger vows cleanse earth giant humanoid titans brought humanity brink extinction . "
459,"two unlikely companions embark perilous adventure badlands unexplored planet try escape dangerous disorienting reality , inner thoughts seen heard everyone . "
460,"blends style classic sitcoms mcu , wanda maximoff vision - two super-powered beings living ideal suburban lives - begin suspect everything seems . "
461,"crypto-zoological agency monarch faces battery god-sized monsters , including mighty godzilla , collides mothra , rodan , ultimate nemesis , three-headed king ghidorah . "
462,"realm known kumandra , re-imagined earth inhabited ancient civilization , warrior named raya determined find last dragon . "
463,"young boy disappears , mother , police chief friends must confront terrifying supernatural forces order get back . "
464,english combat nurse 1945 mysteriously swept back time 1743 . 
465,"diana must contend work colleague businessman , whose desire extreme wealth sends world path destruction , ancient artifact grants wishes goes missing . "
466,"harry potter begins sixth year hogwarts , discovers old book marked `` property half-blood prince '' begins learn lord voldemort 's dark past . "
467,"two brothers follow father 's footsteps hunters , fighting evil supernatural beings many kinds , including monsters , demons gods roam earth . "
468,"vietnam war , team scientists explores uncharted island pacific , venturing domain mighty kong , must fight escape primal eden . "
469,dark forces conspire orphan mapmaker alina starkov unleashes extraordinary power could change fate war-torn world . 
470,"fueled restored faith humanity inspired superman 's selfless act , bruce wayne enlists help new-found ally , diana prince , face even greater enemy . "
471,lucifer morningstar decided 's enough dutiful servant hell decides spend time earth better understand humanity . settles los angeles - city angels . 
472,"epic tale following gang victorian women find unusual abilities , relentless enemies , mission might change world . "
473,"geralt rivia , solitary monster hunter , struggles find place world people often prove wicked beasts . "
474,survivors plane crash forced work together order survive seemingly deserted tropical island . 
475,"lives , loves , dangers disasters town , mystic falls , virginia . creatures unspeakable horror lurk beneath town teenage girl suddenly torn two vampire brothers . "
476,"world ruins , due man-made plague , battle biblical proportions ensues survivors . "
477,"landing gig lifetime , new york jazz pianist suddenly finds trapped strange land earth afterlife . "
478,"orphaned boy enrolls school wizardry , learns truth , family terrible evil haunts magical world . "
479,"stuck time loop , two wedding guests develop budding romance living day . "
480,"single mom two kids arrive small town , begin discover connection original ghostbusters secret legacy grandfather left behind . "
481,team young superheroes combat evil perils . 
482,secret government agency recruits dangerous incarcerated super-villains form defensive task force . first mission : save world apocalypse . 
483,superhero-loving boy without powers determined enroll prestigious hero academy learn really means hero . 
484,sequel thor : ragnarok fourth movie thor saga . 
485,"lt. artemis loyal soldiers transported new world , engage desperate battle survival enormous enemies incredible powers . feature film based video game capcom . "
486,"encounters dragon princess mission , dragon knight becomes embroiled events larger could ever imagined . "
487,"young woman , destined slay vampires , demons infernal creatures , deals life fighting evil , help friends . "
488,"marinette adrien , two normal teens , transform superheroes ladybug cat noir evil threatens city . "
489,"hope mikaelson , tribrid daughter vampire/werewolf hybrid , makes way world . "
490,"imprisoned planet sakaar , thor must race time return asgard stop ragnarök , destruction world , hands powerful ruthless villain hela . "
491,young woman troubled past drawn small town maine fairy tales believed . 
492,recently released ex-convict named shadow meets mysterious man calls `` wednesday '' knows first seems shadow 's life past . 
493,"pilot crashes tells conflict outside world , diana , amazonian warrior training , leaves home fight war , discovering full powers true destiny . "
494,meek hobbit shire eight companions set journey destroy powerful one ring save middle-earth dark lord sauron . 
495,"follows adventures monkey d. luffy pirate crew order find greatest treasure ever left legendary pirate , gold roger . famous mystery treasure named `` one piece '' . "
496,"diana bishop , historian witch , accesses ashmole 782 knows must solve mysteries . offered help enigmatic matthew clairmont , 's vampire witches never trust vampires . "
497,average high school student best friend get caught trouble causing receive werewolf bite . result find middle sorts dramas beacon hills . 
498,band samurai set avenge death dishonor master hands ruthless shogun . 
499,"arthur curry , human-born heir underwater kingdom atlantis , goes quest prevent war worlds ocean land . "
500,"pulp novelist holly martins travels shadowy , postwar vienna , find investigating mysterious death old friend , harry lime . "
501,"two couples visiting niagara falls , tensions one wife husband reach level murder . "
502,screenwriter develops dangerous relationship faded film star determined make triumphant return . 
503,naive 19-year-old widow becomes coarsened cynical sent women 's prison exposed hardened criminals sadistic guards . 
504,"nazi administrator czechoslovakia shot , assassin tries elude gestapo struggles impulse give hostages executed . "
505,"private detective takes case involves three eccentric criminals , gorgeous liar , quest priceless statuette . "
506,insurance representative lets talked seductive housewife murder/insurance fraud scheme arouses suspicion insurance investigator . 
507,psychopath forces tennis star comply theory two strangers get away murder . 
508,"religious fanatic marries gullible widow whose young children reluctant tell real daddy hid $ 10,000 'd stolen robbery . "
509,"stark , perverse story murder , kidnapping , police corruption mexican border town . "
510,"rise fall corrupt politician , makes friends richer retains power dint populist appeal . "
511,woman asked spy group nazi friends south america . far go ingratiate ? 
512,"1903 , doctor suspects murder gothic bederaux family . "
513,crook johnny clay assembles five man team plan execute daring race-track robbery . 
514,"ex-sportswriter hired shady fight promoter promote latest find , unknown easily exploitable rising star argentina . "
515,"world war ii , american expatriate harry morgan helps transport french resistance leader beautiful wife martinique romancing sensuous lounge singer . "
516,"man murdered , apparently one group demobilized soldiers met bar . one ? ? "
517,"private detective philip marlowe hired wealthy family . complex case , 's seen murder , blackmail , might love . "
518,hard-working mother inches towards disaster divorces husband starts successful restaurant business support spoiled daughter . 
519,small-time gambler hired work buenos aires casino discovers employer 's new wife former lover . 
520,psychiatrist protects identity amnesia patient accused murder attempting recover memory . 
521,"embittered , vengeful pow stalks former commanding officer betrayed men 's planned escape attempt nazi prison camp . "
522,"young girl , overjoyed favorite uncle comes visit family , slowly begins suspect fact `` merry widow '' killer sought authorities . "
523,"wrongly accused prisoner barely survives lynch mob attack presumed dead , vindictively decides fake death frame mob supposed murder . "
524,"dumped girlfriend , airline pilot pursues babysitter hotel gradually realizes 's dangerous . "
525,"ambitious nearly insane violent gangster climbs ladder success mob , weaknesses prove downfall . "
526,police detective falls love woman whose murder investigating . 
527,"shy young heiress marries charming gentleman , soon begins suspect planning murder . "
528,four vets attending college gi bill cabaret singer try rob reno casino pull perfect crime . 
529,"potentially violent screenwriter murder suspect lovely neighbor clears . however , soon starts doubts . "
530,"hit men kill unresisting victim , investigator reardon uncovers past involvement beautiful , deadly kitty collins . "
531,"private eye escapes past run gas station small town , past catches . must return big city world danger , corruption , double crosses duplicitous dames . "
532,"years prison , max promises revenge brothers betrayal . lover irene memories past yield broader perspective . "
533,"1940 , american former republican prisoner spanish civil war , john mckittrick , determined find killer nypd lieutenant louie lepetino , helped escape . "
534,"frustrated former big-city journalist stuck working albuquerque newspaper exploits story man trapped cave rekindle career , situation quickly escalates out-of-control circus . "
535,"fascinated gorgeous mrs. bannister , seaman michael o'hara joins bizarre yachting cruise , ends mired complex murder plot . "
536,"man visits war buddy 's family hotel finds gangster running things . hurricane approaches , two end confronting . "
537,investigator war crimes commission travels connecticut find infamous nazi . 
538,"married woman drifter fall love , plot murder husband . "
539,mystery writer becomes involved tangled web murderous deception unlike plots novels . 
540,"writer falls love young socialite 're soon married . obsessive love threatens undoing , everyone else around . "
541,"doomed female hitchhiker pulls mike hammer deadly whirlpool intrigue , revolving around mysterious `` great whatsit '' . "
542,powerful unethical broadway columnist j.j. hunsecker coerces unscrupulous press agent sidney falco breaking sister 's romance jazz musician . 
543,tough cop dave bannion takes politically powerful crime syndicate . 
544,"chance events trap hitchhiking nightclub pianist al roberts tightening net death , deception blackmail . "
545,"conservative middle aged professor engages relationship femme fatale , 's plunged nightmarish world blackmail murder . "
546,desperate life chronic alcoholic followed four-day drinking bout . 
547,"prostitute , sentenced death murder , pleads innocence . "
548,"major heist goes planned , double crosses , bad luck solid police work cause everything unravel . "
549,"rough city cop jim wilson disciplined captain sent upstate , snowy mountain town , help local sheriff solve murder case . "
550,follows political rivalries romance queen elizabeth ii 's reign events shaped second half twentieth century . 
551,"vikings transports us brutal mysterious world ragnar lothbrok , viking warrior farmer yearns explore - raid - distant shores across ocean . "
552,"story 7 people trial stemming various charges surrounding uprising 1968 democratic national convention chicago , illinois . "
553,"april 1986 , explosion chernobyl nuclear power plant union soviet socialist republics becomes one world 's worst man-made catastrophes . "
554,charismatic fisherman drowning debt . troubled woman wrestling real demons . young tax collector ostracized society . religious leader questioning faith tradition . 
555,"bill o'neal infiltrates black panther party per fbi agent mitchell j. edgar hoover . party chairman fred hampton ascends , falling fellow revolutionary en route , battle wages o'neal 's soul . "
556,"alfred great defends kingdom norse invaders , uhtred - born saxon raised vikings - seeks claim ancestral birthright . "
557,"story crown princess märtha , fought country marriage tragic events world war ii . "
558,"supernatural , semihistorical , horror anthology series , season inspired different infamous mysterious real life historical tragedy . "
559,archaeologist embarks historically important excavation sutton hoo 1938 . 
560,"story easy company u.s. army 101st airborne division , mission world war ii europe , operation overlord , v-j day . "
561,"life spartacus , gladiator lead rebellion romans . time ally romans , betrayal becoming gladiator , rebellion leads ultimate outcome . "
562,"german-occupied poland world war ii , industrialist oskar schindler gradually becomes concerned jewish workforce witnessing persecution nazis . "
563,"jewish prince betrayed sent slavery roman friend , regains freedom comes back revenge . "
564,"tong wars late 1800s , ah sahm , martial arts prodigy china , immigrates san francisco becomes hatchet man powerful tong chinatown . "
565,"33 ad , roman tribune judea tasked find missing body jesus christ , rose dead . "
566,"march 18 , 1990 , 13 works art stolen isabella stewart gardner museum boston . guards admitted two men posing police officers responding disturbance call , thieves tied guards looted museum . "
567,"real life one america 's foremost founding fathers first secretary treasury , alexander hamilton . captured live broadway richard rodgers theater original broadway cast . "
568,"all-star , large scale epic movie chronicles life ministry jesus christ . "
569,"path new world , unsettling intricate story genocides . conquest , slavery fabrication `` whiteness '' . "
570,atlantic city politician plays sides law conspiring gangsters prohibition era . 
571,"chronicle four friends decade everything changed , including rise aids . "
572,chronicles lives group midwives living east london late-1950s mid-1960s . 
573,"adaptation homer 's great epic , film follows assault troy united greek forces chronicles fates men involved . "
574,"world war ii american army medic desmond t. doss , served battle okinawa , refuses kill people , becomes first man american history receive medal honor without firing shot . "
575,"allied soldiers belgium , british empire , france surrounded german army evacuated fierce battle world war ii . "
576,scottish warrior william wallace leads countrymen rebellion free homeland tyranny king edward england . 
577,"successful lawman 's plans retire anonymously tombstone , arizona disrupted kind outlaws famous eliminating . "
578,dr. bernard nathanson dr. mildred jefferson square national battle untold conspiracy led famous controversial court case history . 
579,"death marcus aurelius leads succession crisis , deceased emperor 's son , commodus , demonstrates unwilling let anything undermine claim roman empire . "
580,"royal woman living rural russia 18th century forced choose personal happiness future russia , marries emperor . "
581,dramatic series reign marriages king henry viii . 
582,"story joan stanley , exposed k.g.b . 's longest-serving british spy . "
583,"beginning nativity extending crucifixion resurrection , mini-series brings life sweeping drama life jesus , told gospels . "
584,frontiersman fur trading expedition 1820s fights survival mauled bear left dead members hunting team . 
585,2006-2007 group investors bet us mortgage market . research discover flawed corrupt market . 
586,"ross poldark returns home american revolutionary war rebuilds life new business venture , making new enemies finding new love least expects . "
587,"show set late 1800s , revolving around characters deadwood , south dakota ; town deep corruption crime . "
588,"rap group nwa emerges mean streets compton los angeles , california , mid-1980s revolutionizes hip hop culture music tales life hood . "
589,down-to-earth account lives illustrious ordinary romans set last days roman republic . 
590,"life stories history 's greatest minds . days young adults final years see discoveries , loves , relationships , causes , flaws genius . "
591,"story battle midway , told leaders sailors fought . "
592,"several months u.s. entry world war ii , inexperienced u.s. navy commander must lead allied convoy stalked german submarine wolf pack . "
593,"hal , wayward prince heir english throne , crowned king henry v tyrannical father dies . young king must navigate palace politics , war father left behind , emotional strings past life . "
594,"real-life pirates caribbean violently plunder , stealing form surprisingly egalitarian republic documentary series . "
595,story team female african-american mathematicians served vital role nasa early years u.s. space program . 
596,"early life queen victoria , ascension throne tender age eighteen courtship marriage prince albert . "
597,"19th-century france , jean valjean , decades hunted ruthless policeman javert breaking parole , agrees care factory worker 's daughter . decision changes lives forever . "
598,"heroic story ertugrul ghazi , father osman ( uthman ) founded ottoman empire . "
599,"details graphic shocking undeniably tragic story rome 's infamous caesar , gaius germanicus caligula . "
600,sheriff deputy rick grimes wakes coma learn world ruins must lead group survivors stay alive . 
601,adult animated series based skybound/image comic teenager whose father powerful superhero planet . 
602,"black family moves all-white los angeles neighborhood malevolent forces , next door otherworldly , threaten taunt , ravage destroy . "
603,"hometown destroyed mother killed , young eren jaeger vows cleanse earth giant humanoid titans brought humanity brink extinction . "
604,"16 year-old girl returns home camp learns mother new boyfriend , one intends marry ; man whose charm , intelligence beauty make look like 's human . "
605,"young boy disappears , mother , police chief friends must confront terrifying supernatural forces order get back . "
606,"two brothers follow father 's footsteps hunters , fighting evil supernatural beings many kinds , including monsters , demons gods roam earth . "
607,"hearing-impaired girl visited virgin mary suddenly hear , speak , heal sick . people flock witness miracles , terrifying events unfold . work virgin mary something much sinister ? "
608,"walking dead spin-off , set los angeles , following two families must band together survive undead apocalypse . "
609,"anthology series centering different characters locations , including house murderous past , insane asylum , witch coven , freak show circus , haunted hotel , possessed farmhouse , cult , apocalypse , slasher summer camp . "
610,"lives , loves , dangers disasters town , mystic falls , virginia . creatures unspeakable horror lurk beneath town teenage girl suddenly torn two vampire brothers . "
611,"world ruins , due man-made plague , battle biblical proportions ensues survivors . "
612,"criminal mastermind unleashes twisted form justice spiral , terrifying new chapter book saw . "
613,"artist relocates hudson valley begins suspect marriage sinister darkness , one rivals new home 's history . "
614,couple travels scandinavia visit rural hometown 's fabled swedish mid-summer festival . begins idyllic retreat quickly devolves increasingly violent bizarre competition hands pagan cult . 
615,"supernatural , semihistorical , horror anthology series , season inspired different infamous mysterious real life historical tragedy . "
616,"hope mikaelson , tribrid daughter vampire/werewolf hybrid , makes way world . "
617,successful author veronica henley finds trapped horrifying reality must uncover mind-bending mystery 's late . 
618,"quiet drifter tricked janitorial job condemned willy 's wonderland . mundane tasks suddenly become all-out fight survival wave wave demonic animatronics . fists fly , kicks land , titans clash -- one side make alive . "
619,"following zombie outbreak las vegas , group mercenaries take ultimate gamble , venturing quarantine zone pull greatest heist ever attempted . "
620,philadelphia couple mourning unspeakable tragedy creates rift marriage opens door mysterious force enter home . 
621,family power-hungry thousand-year-old vampires look take back city built dominate done wrong . 
622,fictional creepshow comic books come life anthology series terrifying tales hosted silent creepshow ghoul . 
